{
  "schema": "subactor.mutation-proposal-receipt/v1",
  "proposalId": "d40fc803-88af-4b51-a4c2-ba5d76fc08b7",
  "projectId": "mutation-demo",
  "mode": "propose",
  "startedAt": "2026-08-06T20:18:27.658Z",
  "planHash": "aaaaaaaaaaaaaaaaaaaaaaaaaaaaaaaaaaaaaaaaaaaaaaaaaaaaaaaaaaaaaaaa",
  "grantJti": "Fzu28Xp4inEgus1f_ce_HQ",
  "actor": "manager@example.com",
  "developmentRoot": "/home/tom/github/bioxfoundry/twin-dsl/.mutation-demo/code",
  "stages": [
    {
      "name": "grant",
      "status": "succeeded",
      "reason": "jti=Fzu28Xp4inEgus1f_ce_HQ"
    },
    {
      "name": "isolate",
      "status": "succeeded",
      "reason": "directory-copy"
    },
    {
      "name": "propose-source-patch",
      "status": "succeeded",
      "reason": "local-empty-proposal"
    }
  ],
  "status": "proposed",
  "grantVerified": true,
  "completedAt": "2026-08-06T20:18:27.683Z",
  "workspace": {
    "kind": "directory-copy",
    "path": "/home/tom/github/bioxfoundry/twin-dsl/.mutation-demo/out/mutations/workspaces/mutation-demo-326082e9"
  },
  "sourcePatchUri": "urn:subactor:source-patch:sha256:20a6955b8a91637c5f61ca4f83c285a7ecda6c2987abbfdec7113bea0ad33cc5",
  "sourcePatchPath": "/home/tom/github/bioxfoundry/twin-dsl/.mutation-demo/out/mutations/d40fc803-88af-4b51-a4c2-ba5d76fc08b7.source-patch.json",
  "failures": [],
  "proposalUri": "urn:subactor:mutation-proposal:sha256:cd446480d282f2363df7a80e49fe5e2b2aa9498a57296d0515ad8c8ecb38dbcb"
}
